school_id,song name,lyrics,Latitude,Longitude
stanford,Come Join the Band,"Come join the band
And give a cheer for Stanford Red
Throughout the land
Our banner waving overhead
Stanford for you
Each loyal comrade brave and true
With might and main sings this refrain
Forever and forever, Stanford Red

After the game
When Stanford Red has won the day
Praising her name
Down to the field, we'll force our way
And on the green
Each man who joins the serpentine
With might and main sings this refrain

Forever and forever, Stanford Red",37.4277,122.1701
utah,Utah Man,"
I am a Utah Man/Fan, sir, and I live across the green,
Our gang it is the jolliest that you have ever seen.
Our students are the finest and each one's a shining star,
Our yell, you'll hear it ringing through the mountains near and far!


Who am I, sir,
A Utah Man/Fan am I!
A Utah Man/Fan, sir,
Will be 'til I die.
Ki-yi!
We're up to snuff, we never bluff, we're game for any fuss.
No rival band of college fans dare meet us in The Muss.
So fill your lungs and sing it out and shout it to the sky,
We'll fight for dear old crimson for a Utah Man/Fan am I!
Ki-yi!

And when we prom the avenue,
All lined up in a row, and arm in arm,
And step in time as down the street we go.
No matter if a freshman green, or in a senior's gown,
the people all admit we are the warmest gang in town.
We may not live forever on this jolly good sphere,
But while we do we'll live a life of merriment and cheer,
And when our college days are o'er and night is drawing nigh,
With parting breath we'll sing that song: ""A Utah Man/Fan Am I.""

Go Utes!",40.7649,111.8421
washington_state,The Fight Song,"Fight, fight, fight for Washington State!
Win the victory!
Win the day for Crimson and Gray!
Best in the West
We know you'll all do your best
So on, on, on, on! Fight to the end!
Honor and glory you must win!
So fight, fight, fight for Washington State and victory!
W-A-SHI-N-G-TON, S-T-ATE, C-O-UGS!
Go, Cougs!",46.7289,117.1468
alabama,Yea Alabama,"Yea, Alabama! Drown ’em Tide!
Every ‘Bama man’s behind you,
Hit your stride.
Go teach the Bulldogs to behave,
Send the Yellow Jackets to a watery grave.
And if a man starts to weaken,
That’s a shame!
For Bama’s pluck and grit have
Writ her name in Crimson flame.
Fight on, fight on, fight on men!
Remember the Rose Bowl, we’ll win then.
So roll on to victory,
Hit your stride,
You’re Dixie’s football pride,
Crimson Tide, Roll Tide, Roll Tide!!",33.2114,87.5401
arkansas,Arkansas Fight,"Hit that line
Hit that line
Keep on going
Move that ball right down the field
Give a cheer, rah, rah!
Never fear, rah, rah!
Arkansas will never yield
On your toes, Razorbacks, to the finish
Carry on with all your might
For it's A-A-A-R-K-A-N-S-A-S for Arkansas
Fight, fight, fight!",36.0687,94.1748
auburn,War Eagle,"War Eagle, fly down the field
Ever to conquer, never to yield
War Eagle, fearless and true
Fight on you Orange and Blue
Go! Go! Go!
On to vict'ry, strike up the band
Give 'em hell, give 'em hell
Stand up and yell, hey!
War Eagle, win for Auburn
Power of Dixieland!",32.5981,85.4943
florida,The Orange and Blue,"So give a cheer for the Orange and Blue
Waving forever!
Forever pride of Old Florida
May she droop never
We'll sing a song for the flag today
Cheer for the team at play!
On to the goal
We'll fight our way for
Flor-i-da! (Go, Gators!)",29.6465,82.3533
georgia,"Glory, Glory","Glory, glory to old Georgia
Glory, glory to old Georgia
Glory, glory to old Georgia
G-E-O-R-G-I-A

Glory, glory to old Georgia
Glory, glory to old Georgia
Glory, glory to old Georgia
G-E-O-R-G-I-A",33.9423,83.3724
kentucky,On! On! U of K,"On, on, U of K
We are right for the fight today
Hold that ball and hit that line
Ev'ry Wildcat star will shine
We'll fight, fight, fight
For the Blue and White
As we roll to that goal, Varsity
And we'll kick, pass and run
'Til the battle is won
And we'll bring home the victory",38.0307,84.504
lsu,Fight for LSU,"Like knights of old, let's fight to hold
The glory of the purple, gold
Let's carry through, let's die or do
To win the game for dear old LSU
Keep trying for that high score
Come on and fight
We want some more, some more
Come on, you Tigers, fight, fight, fight
For dear old LSU (Rah!)",30.4102,91.1857
mississippi,Forward Rebels,"Forward, Rebels, march to fame
Hit that line, and win this game
We know that you'll fight it through
For your colors, red and blue
Fight, fight, fight


Rebels, you're the Southland's pride
Take that ball, and hit your stride
Don't stop 'til the victory's won
For your Ole Miss
Fight, fight, for your Ole Miss",34.3662,89.538
mississippi_state,Hail State,"Hail dear ol' State
Fight for that victory today
Hit that line and tote that ball
Cross the goal before you fall
And then we'll yell, yell, yell, yell
For dear ol' State, we'll yell like H-E-L-L
Fight for Mis-sis-sip-pi State
Win that game today",33.4577,88.7942
missouri,Fight Tiger,"Fight, Tiger, fight for old Mizzou
Right behind you, ev'ryone is with you
Break the line and follow down the field
And you'll be up on the top, upon the top

Fight, Tiger, you will always win
Proudly keep the colors flying skyward
In the end, we'll win the victory
So Tiger, fight for old Mizzou",38.9404,92.3277
south_carolina,The Fighting Gamecocks Lead the Way (Step to the Rear),"
Hey! Let's give a cheer
Carolina is here
The fighting Gamecocks lead the way
Who gives a care
If the going gets tough
And when it is rough
That's when the 'Cocks get going

Hail to our colors of Garnet and Black
In Carolina pride have we
So, go Gamecocks go—fight!
Drive for the goal—fight!
USC will win today—go 'Cocks!
So, let's give a cheer
Carolina is here
The fighting Gamecocks all the way!",33.9949,81.0285
tennessee,Rocky Top,"Wish that I was on old Rocky Top
Down in the Tennessee hills
Ain't no smoggy smoke on Rocky Top
Ain't no telephone bills
Once I had a girl on Rocky Top
Half bear the other half cat
Wild as a mink but sweet as soda-pop
I still dream about that

Rocky Top you'll always be
Home sweet home to me
Good ol' Rocky Top
Rocky Top Tennessee, Rocky Top Tennessee

Once two strangers climbed ol' Rocky Top
Looking for a moonshine still
Strangers ain't come down from Rocky Top
Reckon they never will
The corn won't grow at all on Rocky Top
Dirt's too rocky by far
That's why all the folks on Rocky Top
Get their corn from a jar

Rocky Top you'll always be
Home sweet home to me
Good ol' Rocky Top
Rocky Top Tennessee, Rocky Top Tennessee",35.9544,83.9295
texas_aandm,Aggie War Hymn,"
Hullabaloo, caneck, caneck
Hullabaloo, caneck, caneck


Good-bye to Texas University
So long to the Orange and the White
Good luck to the dear old Texas Aggies
They are the boys that show the real old fight
""The Eyes of Texas are upon you""
That is the song they sing so well
Sounds like hell!
So good-bye to Texas University
We're going to beat you all to
Chig-gar-roo-gar-rem
Chig-gar-roo-gar-rem
Rough tough, real stuff, Texas A&M


Good-bye to Texas University
So long to the Orange and the White
Good luck to the dear old Texas Aggies
They are the boys that show the real old fight
""The Eyes of Texas are upon you""
That is the song they sing so well
Sounds like hell!
So good-bye to Texas University
We're going to beat you all to
Chig-gar-roo-gar-rem
Chig-gar-roo-gar-rem
Rough tough, real stuff, Texas A&M",30.6187,96.3364
vanderbilt,Dynamite,"Dynamite, Dynamite
When Vandy starts to fight
Down the field with blood to yield
If need be, save the shield
If victory's won, when battle's done
Then Vandy's name will rise in fame
But, win or lose, the fates will choose
And Vandy's game will be the same
Dynamite, Dynamite
When Vandy starts to fight (Fight!)",36.1447,86.8027